[
  {"schema_version":"1.0","id":"a1b2c3d4-0001","kind":"episode","created_at":"2026-09-01T20:10:00-07:00","started_at":"2026-09-01T19:40:00-07:00","ended_at":"2026-09-01T20:05:00-07:00","model_version":"placeholder-v0",
   "marks":[{"location":{"part_id":"pectoralis_major","side":"left","local":[0.4,0.6,0.9],"depth":"deep","view":"anterior"},"shape":"patch","intensity":7,"radius":0.3,"descriptors":["tight","palpitations","short_breath","dizzy"]}],
   "context":{"activity":"坐在电脑前，赶一个截止","onset":"sudden","pattern":"once","associated":["手发抖"]},
   "mind":{"stress":8,"mood":3,"sleep_hours":5}},
  {"schema_version":"1.0","id":"a1b2c3d4-0002","kind":"visit","created_at":"2026-09-03T15:00:00-07:00","started_at":"2026-09-03T14:00:00-07:00",
   "visit":{"department":"urgent_care","clinician":"","said":"ECG 正常，血检正常","did":"ECG，血常规"},
   "tests":[{"name":"ECG","result":"normal","date":"2026-09-03"},{"name":"血常规","result":"normal","date":"2026-09-03"}]},
  {"schema_version":"1.0","id":"a1b2c3d4-0003","kind":"episode","created_at":"2026-09-09T23:30:00-07:00","started_at":"2026-09-09T23:05:00-07:00","ended_at":"2026-09-09T23:35:00-07:00","model_version":"placeholder-v0",
   "marks":[{"location":{"part_id":"pectoralis_major","side":"left","local":[0.42,0.58,0.9],"depth":"deep","view":"anterior"},"shape":"patch","intensity":6,"radius":0.3,"descriptors":["tight","palpitations","shaky"]}],
   "context":{"activity":"睡前","onset":"sudden","pattern":"once"},
   "mind":{"stress":7,"mood":4,"sleep_hours":4.5}},
  {"schema_version":"1.0","id":"a1b2c3d4-0004","kind":"episode","created_at":"2026-09-12T13:00:00-07:00","started_at":"2026-09-12T12:53:00-07:00","ended_at":"2026-09-12T13:50:00-07:00","model_version":"placeholder-v0",
   "marks":[{"location":{"part_id":"vastus_lateralis","side":"left","local":[0.62,0.41,0.8],"depth":"muscle","view":"anterior"},"shape":"point","intensity":5,"descriptors":["stabbing"],"note":"阵阵刺痛"}],
   "context":{"activity":"久坐后站起来","onset":"gradual","pattern":"comes_and_goes","triggers":["久坐"],"relief":["走动"]}},
  {"schema_version":"1.0","id":"a1b2c3d4-0005","kind":"episode","created_at":"2026-09-26T08:00:00-07:00","started_at":"2026-09-26T07:30:00-07:00","ended_at":null,"model_version":"placeholder-v0",
   "marks":[{"location":{"part_id":"pectoralis_major","side":"left","local":[0.4,0.6,0.9],"depth":"deep","view":"anterior"},"shape":"patch","intensity":6,"radius":0.25,"descriptors":["tight","palpitations","dizzy","sweating"]}],
   "context":{"activity":"刚醒","onset":"sudden","pattern":"once"},
   "mind":{"stress":6,"mood":4,"sleep_hours":6}},
  {"schema_version":"1.0","id":"a1b2c3d4-0006","kind":"episode","created_at":"2026-09-26T09:00:00-07:00","started_at":"2026-09-26T07:30:00-07:00","ended_at":"2026-09-26T08:10:00-07:00","supersedes":"a1b2c3d4-0005","model_version":"placeholder-v0",
   "marks":[{"location":{"part_id":"pectoralis_major","side":"left","local":[0.4,0.6,0.9],"depth":"deep","view":"anterior"},"shape":"patch","intensity":6,"radius":0.25,"descriptors":["tight","palpitations","dizzy","sweating"]}],
   "context":{"activity":"刚醒","onset":"sudden","pattern":"once"},
   "mind":{"stress":6,"mood":4,"sleep_hours":6}}
]
